{
  "required" : true ,
  "$schema" : "http://json-schema.org/draft-03/schema" ,
  "type" : "object" ,
  "properties" : {
    "@odata.type" : {
      "type" : "string" ,
      "required" : false
    } ,
    "Subject" : {
      "type" : "string" ,
      "required" : false
    } ,
    "Body" : {
      "type" : "object" ,
      "required" : false ,
      "properties" : {
        "ContentType" : {
          "type" : "string" ,
          "required" : false
        } ,
        "Content" : {
          "type" : "string" ,
          "required" : false
        }
      }
    } ,
    "Start" : {
      "type" : "string" ,
      "required" : false
    } ,
    "End" : {
      "type" : "string" ,
      "required" : false
    } ,
    "Location" : {
      "type" : "object" ,
      "required" : false ,
      "properties" : {
        "DisplayName" : {
          "type" : "string" ,
          "required" : false
        }
      }
    } ,
    "ShowAs" : {
      "type" : "string" ,
      "required" : false
    } ,
    "Attendees" : {
      "type" : "array" ,
      "required" : false ,
      "items" : [
        {
          "type" : "object" ,
          "properties" : {
            "Name" : {
              "type" : "string" ,
              "required" : false
            } ,
            "Address" : {
              "type" : "string" ,
              "required" : false
            } ,
            "Type" : {
              "type" : "string" ,
              "required" : false
            }
          }
        }
      ]
    }
  }
}